{
    "id": "pc_002",
    "name": "Elizabeth Bennet",
    "playerName": "Sarah Johnson",
    "type": "PC",
    "age": 27,
    "gender": "Female",
    "occupation": "Journalist",
    "birthplace": "Chicago, Illinois",
    "residence": "New York City, New York",
    "attributes": {
      "str": 50,
      "con": 60,
      "siz": 55,
      "dex": 65,
      "app": 70,
      "int": 80,
      "pow": 75,
      "edu": 85,
      "luck": 60
    },
    "derivedAttributes": {
      "hp": 11,
      "san": 75,
      "mp": 15,
      "db": "0",
      "build": 0,
      "move": 9
    },
    "skills": {
      "libraryUse": 80,
      "psychology": 70,
      "fastTalk": 60,
      "artCraft": [
        {
          "type": "Photography",
          "value": 75
        }
      ],
      "languageOwn": 85,
      "languageOther": [
        {
          "language": "Spanish",
          "value": 40
        }
      ],
      "spotHidden": 65
    },
    "inventory": [
      {
        "itemName": "Camera",
        "description": "High-quality camera for professional photography",
        "quantity": 1
      },
      {
        "itemName": "Notepad",
        "description": "For taking notes during investigations",
        "quantity": 1
      }
    ],
    "weapons": [
      {
        "weaponName": "Pocket Knife",
        "skill": "Fighting (Brawl)",
        "damage": "1D4+DB",
        "range": "Melee",
        "attacksPerRound": "1",
        "ammo": "N/A",
        "malfunction": "N/A"
      }
    ],
    "spells": [],
    "backstory": {
      "personalDescription": "An inquisitive journalist with a keen eye for detail.",
      "ideologyBeliefs": "Passionate about uncovering the truth.",
      "significantPeople": "Mentor: Veteran journalist Robert Harris.",
      "meaningfulLocations": "The newsroom where she began her career.",
      "treasuredPossessions": "Her father's old typewriter.",
      "traits": "Curious, determined, and fearless.",
      "injuriesScars": "None",
      "phobiasManias": "Claustrophobia in tight spaces.",
      "arcaneTomesSpellsArtifacts": "None",
      "encountersWithStrangeEntities": "Witnessed a bizarre ritual during an undercover investigation."
    },
    "notes": "Currently investigating a series of unexplained events in the city.",
    "image": "https://example.com/images/elizabeth_bennet.jpg"
  }
  